,plugin_id,cve_id,CVSS_v2.0_base_score,risk,host,protocol,port,name,synopsis,description,solution,cvss_v3,cvss_v2,vpr,epss,age_days,core_impact,real_row,source
32,57041,,,,65.61.137.117,tcp,443,SSL Perfect Forward Secrecy Cipher Suites Supported,"The remote service supports the use of SSL Perfect Forward Secrecy
ciphers, which maintain confidentiality even if the key is stolen.","The remote host supports the use of SSL ciphers that offer Perfect
Forward Secrecy (PFS) encryption.  These cipher suites ensure that
recorded SSL traffic cannot be broken at a future date if the server's
private key is compromised.",,,,,,5050.0,,"{'Plugin ID': '57041', 'CVE': nan, 'CVSS v2.0 Base Score': nan, 'Risk': nan, 'Host': '65.61.137.117', 'Protocol': 'tcp', 'Port': '443', 'Name': 'SSL Perfect Forward Secrecy Cipher Suites Supported', 'Synopsis': 'The remote service supports the use of SSL Perfect Forward Secrecy\nciphers, which maintain confidentiality even if the key is stolen.', 'Description': ""The remote host supports the use of SSL ciphers that offer Perfect\nForward Secrecy (PFS) encryption.  These cipher suites ensure that\nrecorded SSL traffic cannot be broken at a future date if the server's\nprivate key is compromised."", 'Solution': nan, 'See Also': 'https://www.openssl.org/docs/manmaster/man1/ciphers.html\nhttps://en.wikipedia.org/wiki/Diffie-Hellman_key_exchange\nhttps://en.wikipedia.org/wiki/Perfect_forward_secrecy', 'Plugin Output': '\nHere is the list of SSL PFS ciphers supported by the remote server :\n\n  High Strength Ciphers (>= 112-bit key)\n\n    Name                          Code             KEX           Auth     Encryption             MAC\n    ----------------------        ----------       ---           ----     ---------------------  ---\n    DHE-RSA-AES128-SHA256         0x00, 0x9E       DH            RSA      AES-GCM(128)           SHA256\n    DHE-RSA-AES256-SHA384         0x00, 0x9F       DH            RSA      AES-GCM(256)           SHA384\n    ECDHE-RSA-AES128-SHA256       0xC0, 0x2F       ECDH          RSA      AES-GCM(128)           SHA256\n    ECDHE-RSA-AES256-SHA384       0xC0, 0x30       ECDH          RSA      AES-GCM(256)           SHA384\n    DHE-RSA-AES128-SHA            0x00, 0x33       DH            RSA      AES-CBC(128)           SHA1\n    DHE-RSA-AES256-SHA            0x00, 0x39       DH            RSA      AES-CBC(256)           SHA1\n    ECDHE-RSA-AES128-SHA          0xC0, 0x13       ECDH          RSA      AES-CBC(128)           SHA1\n    ECDHE-RSA-AES256-SHA          0xC0, 0x14       ECDH          RSA      AES-CBC(256)           SHA1\n    DHE-RSA-AES128-SHA256         0x00, 0x67       DH            RSA      AES-CBC(128)           SHA256\n    DHE-RSA-AES256-SHA256         0x00, 0x6B       DH            RSA      AES-CBC(256)           SHA256\n    ECDHE-RSA-AES128-SHA256       0xC0, 0x27       ECDH          RSA      AES-CBC(128)           SHA256\n    ECDHE-RSA-AES256-SHA384       0xC0, 0x28       ECDH          RSA      AES-CBC(256)           SHA384\n\nThe fields above are :\n\n  {Tenable ciphername}\n  {Cipher ID code}\n  Kex={key exchange}\n  Auth={authentication}\n  Encrypt={symmetric encryption method}\n  MAC={message authentication code}\n  {export flag}\n', 'STIG Severity': nan, 'CVSS v4.0 Base Score': nan, 'CVSS v4.0 Base+Threat Score': nan, 'CVSS v3.0 Base Score': nan, 'CVSS v2.0 Temporal Score': nan, 'CVSS v3.0 Temporal Score': nan, 'VPR Score': nan, 'EPSS Score': nan, 'Risk Factor': nan, 'BID': nan, 'XREF': nan, 'MSKB': nan, 'Plugin Publication Date': '2011/12/07', 'Plugin Modification Date': '2021/03/09', 'Metasploit': nan, 'Core Impact': nan, 'CANVAS': nan}",
33,70544,,,,65.61.137.117,tcp,443,SSL Cipher Block Chaining Cipher Suites Supported,"The remote service supports the use of SSL Cipher Block Chaining
ciphers, which combine previous blocks with subsequent ones.","The remote host supports the use of SSL ciphers that operate in Cipher
Block Chaining (CBC) mode.  These cipher suites offer additional
security over Electronic Codebook (ECB) mode, but have the potential to
leak information if used improperly.",,,,,,4365.0,,"{'Plugin ID': '70544', 'CVE': nan, 'CVSS v2.0 Base Score': nan, 'Risk': nan, 'Host': '65.61.137.117', 'Protocol': 'tcp', 'Port': '443', 'Name': 'SSL Cipher Block Chaining Cipher Suites Supported', 'Synopsis': 'The remote service supports the use of SSL Cipher Block Chaining\nciphers, which combine previous blocks with subsequent ones.', 'Description': 'The remote host supports the use of SSL ciphers that operate in Cipher\nBlock Chaining (CBC) mode.  These cipher suites offer additional\nsecurity over Electronic Codebook (ECB) mode, but have the potential to\nleak information if used improperly.', 'Solution': nan, 'See Also': 'https://www.openssl.org/docs/manmaster/man1/ciphers.html\nhttp://www.nessus.org/u?cc4a822a\nhttps://www.openssl.org/~bodo/tls-cbc.txt', 'Plugin Output': '\nHere is the list of SSL CBC ciphers supported by the remote server :\n\n  High Strength Ciphers (>= 112-bit key)\n\n    Name                          Code             KEX           Auth     Encryption             MAC\n    ----------------------        ----------       ---           ----     ---------------------  ---\n    DHE-RSA-AES128-SHA            0x00, 0x33       DH            RSA      AES-CBC(128)           SHA1\n    DHE-RSA-AES256-SHA            0x00, 0x39       DH            RSA      AES-CBC(256)           SHA1\n    ECDHE-RSA-AES128-SHA          0xC0, 0x13       ECDH          RSA      AES-CBC(128)           SHA1\n    ECDHE-RSA-AES256-SHA          0xC0, 0x14       ECDH          RSA      AES-CBC(256)           SHA1\n    DHE-RSA-AES128-SHA256         0x00, 0x67       DH            RSA      AES-CBC(128)           SHA256\n    DHE-RSA-AES256-SHA256         0x00, 0x6B       DH            RSA      AES-CBC(256)           SHA256\n    ECDHE-RSA-AES128-SHA256       0xC0, 0x27       ECDH          RSA      AES-CBC(128)           SHA256\n    ECDHE-RSA-AES256-SHA384       0xC0, 0x28       ECDH          RSA      AES-CBC(256)           SHA384\n\nThe fields above are :\n\n  {Tenable ciphername}\n  {Cipher ID code}\n  Kex={key exchange}\n  Auth={authentication}\n  Encrypt={symmetric encryption method}\n  MAC={message authentication code}\n  {export flag}\n', 'STIG Severity': nan, 'CVSS v4.0 Base Score': nan, 'CVSS v4.0 Base+Threat Score': nan, 'CVSS v3.0 Base Score': nan, 'CVSS v2.0 Temporal Score': nan, 'CVSS v3.0 Temporal Score': nan, 'VPR Score': nan, 'EPSS Score': nan, 'Risk Factor': nan, 'BID': nan, 'XREF': nan, 'MSKB': nan, 'Plugin Publication Date': '2013/10/22', 'Plugin Modification Date': '2021/02/03', 'Metasploit': nan, 'Core Impact': nan, 'CANVAS': nan}",
34,83875,CVE-2015-4000,2.6,Low,65.61.137.117,tcp,443,SSL/TLS Diffie-Hellman Modulus <= 1024 Bits (Logjam),"The remote host allows SSL/TLS connections with one or more
Diffie-Hellman moduli less than or equal to 1024 bits.","The remote host allows SSL/TLS connections with one or more
Diffie-Hellman moduli less than or equal to 1024 bits. Through
cryptanalysis, a third party may be able to find the shared secret in
a short amount of time (depending on modulus size and attacker
resources). This may allow an attacker to recover the plaintext or
potentially violate the integrity of connections.","Reconfigure the service to use a unique Diffie-Hellman moduli of 2048
bits or greater.",3.700000047683716,2.5999999046325684,3.9000000953674316,0.9391000270843506,3782.0,,"{'Plugin ID': '83875', 'CVE': 'CVE-2015-4000', 'CVSS v2.0 Base Score': '2.6', 'Risk': 'Low', 'Host': '65.61.137.117', 'Protocol': 'tcp', 'Port': '443', 'Name': 'SSL/TLS Diffie-Hellman Modulus <= 1024 Bits (Logjam)', 'Synopsis': 'The remote host allows SSL/TLS connections with one or more\nDiffie-Hellman moduli less than or equal to 1024 bits.', 'Description': 'The remote host allows SSL/TLS connections with one or more\nDiffie-Hellman moduli less than or equal to 1024 bits. Through\ncryptanalysis, a third party may be able to find the shared secret in\na short amount of time (depending on modulus size and attacker\nresources). This may allow an attacker to recover the plaintext or\npotentially violate the integrity of connections.', 'Solution': 'Reconfigure the service to use a unique Diffie-Hellman moduli of 2048\nbits or greater.', 'See Also': 'https://weakdh.org/', 'Plugin Output': '\nVulnerable connection combinations :\n\n  SSL/TLS version  : TLSv1.0\n  Cipher suite     : TLS1_CK_DHE_RSA_WITH_AES_256_CBC_SHA\n  Diffie-Hellman MODP size (bits) : 1024\n    Warning - This is a known static Oakley Group2 modulus. This may make\n    the remote host more vulnerable to the Logjam attack.\n  Logjam attack difficulty : Hard (would require nation-state resources)\n\n  SSL/TLS version  : TLSv1.0\n  Cipher suite     : TLS1_CK_DHE_RSA_WITH_AES_128_CBC_SHA\n  Diffie-Hellman MODP size (bits) : 1024\n    Warning - This is a known static Oakley Group2 modulus. This may make\n    the remote host more vulnerable to the Logjam attack.\n  Logjam attack difficulty : Hard (would require nation-state resources)\n\n  SSL/TLS version  : TLSv1.1\n  Cipher suite     : TLS1_CK_DHE_RSA_WITH_AES_256_CBC_SHA\n  Diffie-Hellman MODP size (bits) : 1024\n    Warning - This is a known static Oakley Group2 modulus. This may make\n    the remote host more vulnerable to the Logjam attack.\n  Logjam attack difficulty : Hard (would require nation-state resources)\n\n  SSL/TLS version  : TLSv1.1\n  Cipher suite     : TLS1_CK_DHE_RSA_WITH_AES_128_CBC_SHA\n  Diffie-Hellman MODP size (bits) : 1024\n    Warning - This is a known static Oakley Group2 modulus. This may make\n    the remote host more vulnerable to the Logjam attack.\n  Logjam attack difficulty : Hard (would require nation-state resources)\n', 'STIG Severity': nan, 'CVSS v4.0 Base Score': nan, 'CVSS v4.0 Base+Threat Score': nan, 'CVSS v3.0 Base Score': '3.7', 'CVSS v2.0 Temporal Score': '1.9', 'CVSS v3.0 Temporal Score': '3.2', 'VPR Score': '3.9', 'EPSS Score': '0.9391', 'Risk Factor': 'Low', 'BID': '74733', 'XREF': 'CEA-ID:CEA-2021-0004', 'MSKB': nan, 'Plugin Publication Date': '2015/05/28', 'Plugin Modification Date': '2024/09/11', 'Metasploit': nan, 'Core Impact': nan, 'CANVAS': nan}",
35,84502,,,,65.61.137.117,tcp,443,HSTS Missing From HTTPS Server,The remote web server is not enforcing HSTS.,"The remote HTTPS server is not enforcing HTTP Strict Transport Security (HSTS). 
HSTS is an optional response header that can be configured on the server to instruct 
the browser to only communicate via HTTPS. The lack of HSTS allows downgrade attacks,
SSL-stripping man-in-the-middle attacks, and weakens cookie-hijacking protections.",Configure the remote web server to use HSTS.,,,,,3747.0,,"{'Plugin ID': '84502', 'CVE': nan, 'CVSS v2.0 Base Score': nan, 'Risk': nan, 'Host': '65.61.137.117', 'Protocol': 'tcp', 'Port': '443', 'Name': 'HSTS Missing From HTTPS Server', 'Synopsis': 'The remote web server is not enforcing HSTS.', 'Description': 'The remote HTTPS server is not enforcing HTTP Strict Transport Security (HSTS). \nHSTS is an optional response header that can be configured on the server to instruct \nthe browser to only communicate via HTTPS. The lack of HSTS allows downgrade attacks,\nSSL-stripping man-in-the-middle attacks, and weakens cookie-hijacking protections.', 'Solution': 'Configure the remote web server to use HSTS.', 'See Also': 'https://tools.ietf.org/html/rfc6797', 'Plugin Output': '\nHTTP/1.1 200 OK\r\nServer: Apache-Coyote/1.1\r\nSet-Cookie: JSESSIONID=B81166B1E4BE9A39538F98E781B1122F; Path=/; Secure; HttpOnly\r\nContent-Type: text/html;charset=ISO-8859-1\r\nTransfer-Encoding: chunked\r\nDate: Tue, 30 Sep 2025 10:56:56 GMT\r\nConnection: close\r\n\r\n\nThe remote HTTPS server does not send the HTTP\n""Strict-Transport-Security"" header.\n', 'STIG Severity': nan, 'CVSS v4.0 Base Score': nan, 'CVSS v4.0 Base+Threat Score': nan, 'CVSS v3.0 Base Score': nan, 'CVSS v2.0 Temporal Score': nan, 'CVSS v3.0 Temporal Score': nan, 'VPR Score': nan, 'EPSS Score': nan, 'Risk Factor': nan, 'BID': nan, 'XREF': nan, 'MSKB': nan, 'Plugin Publication Date': '2015/07/02', 'Plugin Modification Date': '2024/08/09', 'Metasploit': nan, 'Core Impact': nan, 'CANVAS': nan}",
36,94761,,,,65.61.137.117,tcp,443,SSL Root Certification Authority Certificate Information,"A root Certification Authority certificate was found at the top of the
certificate chain.","The remote service uses an SSL certificate chain that contains a
self-signed root Certification Authority certificate at the top of the
chain.","Ensure that use of this root Certification Authority certificate
complies with your organization's acceptable use and security
policies.",,,,,3246.0,,"{'Plugin ID': '94761', 'CVE': nan, 'CVSS v2.0 Base Score': nan, 'Risk': nan, 'Host': '65.61.137.117', 'Protocol': 'tcp', 'Port': '443', 'Name': 'SSL Root Certification Authority Certificate Information', 'Synopsis': 'A root Certification Authority certificate was found at the top of the\ncertificate chain.', 'Description': 'The remote service uses an SSL certificate chain that contains a\nself-signed root Certification Authority certificate at the top of the\nchain.', 'Solution': ""Ensure that use of this root Certification Authority certificate\ncomplies with your organization's acceptable use and security\npolicies."", 'See Also': 'https://docs.microsoft.com/en-us/previous-versions/windows/it-pro/windows-server-2003/cc778623(v=ws.10)', 'Plugin Output': '\nThe following root Certification Authority certificate was found :\n\n|-Subject             : C=GB/ST=Greater Manchester/L=Salford/O=Comodo CA Limited/CN=AAA Certificate Services\n|-Issuer              : C=GB/ST=Greater Manchester/L=Salford/O=Comodo CA Limited/CN=AAA Certificate Services\n|-Valid From          : Jan 01 00:00:00 2004 GMT\n|-Valid To            : Dec 31 23:59:59 2028 GMT\n|-Signature Algorithm : SHA-1 With RSA Encryption\n', 'STIG Severity': nan, 'CVSS v4.0 Base Score': nan, 'CVSS v4.0 Base+Threat Score': nan, 'CVSS v3.0 Base Score': nan, 'CVSS v2.0 Temporal Score': nan, 'CVSS v3.0 Temporal Score': nan, 'VPR Score': nan, 'EPSS Score': nan, 'Risk Factor': nan, 'BID': nan, 'XREF': nan, 'MSKB': nan, 'Plugin Publication Date': '2016/11/14', 'Plugin Modification Date': '2018/11/15', 'Metasploit': nan, 'Core Impact': nan, 'CANVAS': nan}",
37,95631,,,,65.61.137.117,tcp,443,SSL Certificate Signed Using Weak Hashing Algorithm (Known CA),"A known CA SSL certificate in the certificate chain has been signed
using a weak hashing algorithm.","The remote service uses a known CA certificate in the SSL certificate chain that has been signed using a 
cryptographically weak hashing algorithm (e.g., MD2, MD4, MD5, or SHA1). These signature algorithms are known to be 
vulnerable to collision attacks (CVE-2004-2761, for example). An attacker can exploit this to generate another 
certificate with the same digital signature, allowing the attacker to masquerade as the affected service.

Note that this plugin reports all SSL certificate chains signed with SHA-1 that expire after January 1, 2017 as 
vulnerable. This is in accordance with Google's gradual sunsetting of the SHA-1 cryptographic hash algorithm.

Note that this plugin will only fire on root certificates that are known certificate authorities as listed in Tenable 
Community Knowledge Article 000001752. That is what differentiates this plugin from plugin 35291, which will fire on any
certificate, not just known certificate authority root certificates.

Known certificate authority root certificates are inherently trusted and so any potential issues with the signature, 
including it being signed using a weak hashing algorithm, are not considered security issues.",Contact the Certificate Authority to have the certificate reissued.,,,,,3222.0,,"{'Plugin ID': '95631', 'CVE': nan, 'CVSS v2.0 Base Score': nan, 'Risk': nan, 'Host': '65.61.137.117', 'Protocol': 'tcp', 'Port': '443', 'Name': 'SSL Certificate Signed Using Weak Hashing Algorithm (Known CA)', 'Synopsis': 'A known CA SSL certificate in the certificate chain has been signed\nusing a weak hashing algorithm.', 'Description': ""The remote service uses a known CA certificate in the SSL certificate chain that has been signed using a \ncryptographically weak hashing algorithm (e.g., MD2, MD4, MD5, or SHA1). These signature algorithms are known to be \nvulnerable to collision attacks (CVE-2004-2761, for example). An attacker can exploit this to generate another \ncertificate with the same digital signature, allowing the attacker to masquerade as the affected service.\n\nNote that this plugin reports all SSL certificate chains signed with SHA-1 that expire after January 1, 2017 as \nvulnerable. This is in accordance with Google's gradual sunsetting of the SHA-1 cryptographic hash algorithm.\n\nNote that this plugin will only fire on root certificates that are known certificate authorities as listed in Tenable \nCommunity Knowledge Article 000001752. That is what differentiates this plugin from plugin 35291, which will fire on any\ncertificate, not just known certificate authority root certificates.\n\nKnown certificate authority root certificates are inherently trusted and so any potential issues with the signature, \nincluding it being signed using a weak hashing algorithm, are not considered security issues."", 'Solution': 'Contact the Certificate Authority to have the certificate reissued.', 'See Also': 'http://www.nessus.org/u?ae636e78\nhttps://tools.ietf.org/html/rfc3279\nhttp://www.nessus.org/u?9bb87bf2', 'Plugin Output': '\nThe following known CA certificates were part of the certificate\nchain sent by the remote host, but contain hashes that are considered\nto be weak.\n\nSubject             : C=GB/ST=Greater Manchester/L=Salford/O=Comodo CA Limited/CN=AAA Certificate Services\nSignature Algorithm : SHA-1 With RSA Encryption\nValid From          : Jan 01 00:00:00 2004 GMT\nValid To            : Dec 31 23:59:59 2028 GMT\nRaw PEM certificate : \n-----BEGIN CERTIFICATE-----\nMIIEMjCCAxqgAwIBAgIBATANBgkqhkiG9w0BAQUFADB7MQswCQYDVQQGEwJHQjEbMBkGA1UECAwSR3JlYXRlciBNYW5jaGVzdGVyMRAwDgYDVQQHDAdTYWxmb3JkMRowGAYDVQQKDBFDb21vZG8gQ0EgTGltaXRlZDEhMB8GA1UEAwwYQUFBIENlcnRpZmljYXRlIFNlcnZpY2VzMB4XDTA0MDEwMTAwMDAwMFoXDTI4MTIzMTIzNTk1OVowezELMAkGA1UEBhMCR0IxGzAZBgNVBAgMEkdyZWF0ZXIgTWFuY2hlc3RlcjEQMA4GA1UEBwwHU2FsZm9yZDEaMBgGA1UECgwRQ29tb2RvIENBIExpbWl0ZWQxITAfBgNVBAMMGEFBQSBDZXJ0aWZpY2F0ZSBTZXJ2aWNlczCCASIwDQYJKoZIhvcNAQEBBQADggEPADCCAQoCggEBAL5AnfRu4ep2hxxNRUSOvkbIgwadwSr+GB+O5AL686tdUIoWMQuaBtDFcCLNSS1UY8y2bmhGC1Pqy0wkwLxyTurxFa70VJoSCsN6sjNg4tqJVfMiWPPe3M/vg4aijJRPn2jymJBGhCfHdr/jzDUsi14HZGWCwEiwqJH5YZ92IFCokcdmtet4YgNW8IoaE+oxox6gmf049vYnMlhvB/VruPsUK6+3qszWY19zjNoFmag4qMsXeDZRrOme9Hg6jc8P2ULimAyrL58OAd7vn5lJ8S3frHRNG5i1R8XlKdH5kBjHYpy+g8cmez6KJcfA3Z3mNWgQIJ2P2N7Sw4ScDV7oL8kCAwEAAaOBwDCBvTAdBgNVHQ4EFgQUoBEKIz6W8Qfs4q8p74Klf9AwpLQwDgYDVR0PAQH/BAQDAgEGMA8GA1UdEwEB/wQFMAMBAf8wewYDVR0fBHQwcjA4oDagNIYyaHR0cDovL2NybC5jb21vZG9jYS5jb20vQUFBQ2VydGlmaWNhdGVTZXJ2aWNlcy5jcmwwNqA0oDKGMGh0dHA6Ly9jcmwuY29tb2RvLm5ldC9BQUFDZXJ0aWZpY2F0ZVNlcnZpY2VzLmNybDANBgkqhkiG9w0BAQUFAAOCAQEACFb8AvCb6P+k+tZ7xkSAzk/ExfYAWMymtrwUSWgEdujm7l3sAg9g1o1QGE8mTgHj5rCl7r+8dFRBv/38ErjHT1r0iWAFf2C3BUrz9vHCv8S5dIa2LX1rzNLzRt0vxuBqw8M0Ayx9lt1awg6nCpnBBYurDC/zXDrPbDdVCYfeU0BsWO/8tqtlbgT2G9w84FoVxp7Z8VlIMCFlA2zs6SFz7JsDoeA3raAVGI/6ugLOpyypEBMs1OUIJqsil2D4kF501KKaU73yqWjgom7C12yxow+ev+to51byrvLjKzg6CYG1a4XXvi3tPxq3smPi9WIsgtRqAEFQ8TmDn5XpNpaYbg==\n-----END CERTIFICATE-----\n', 'STIG Severity': nan, 'CVSS v4.0 Base Score': nan, 'CVSS v4.0 Base+Threat Score': nan, 'CVSS v3.0 Base Score': nan, 'CVSS v2.0 Temporal Score': nan, 'CVSS v3.0 Temporal Score': nan, 'VPR Score': nan, 'EPSS Score': nan, 'Risk Factor': nan, 'BID': '11849;33065', 'XREF': 'CWE:310', 'MSKB': nan, 'Plugin Publication Date': '2016/12/08', 'Plugin Modification Date': '2022/10/12', 'Metasploit': nan, 'Core Impact': nan, 'CANVAS': nan}",
38,104743,,6.1,Medium,65.61.137.117,tcp,443,TLS Version 1.0 Protocol Detection,The remote service encrypts traffic using an older version of TLS.,"The remote service accepts connections encrypted using TLS 1.0. TLS 1.0 has a
number of cryptographic design flaws. Modern implementations of TLS 1.0
mitigate these problems, but newer versions of TLS like 1.2 and 1.3 are
designed against these flaws and should be used whenever possible.

As of March 31, 2020, Endpoints that arent enabled for TLS 1.2
and higher will no longer function properly with major web browsers and major vendors.

PCI DSS v3.2 requires that TLS 1.0 be disabled entirely by June 30,
2018, except for POS POI terminals (and the SSL/TLS termination
points to which they connect) that can be verified as not being
susceptible to any known exploits.","Enable support for TLS 1.2 and 1.3, and disable support for TLS 1.0.",6.5,6.099999904632568,,,2873.0,,"{'Plugin ID': '104743', 'CVE': nan, 'CVSS v2.0 Base Score': '6.1', 'Risk': 'Medium', 'Host': '65.61.137.117', 'Protocol': 'tcp', 'Port': '443', 'Name': 'TLS Version 1.0 Protocol Detection', 'Synopsis': 'The remote service encrypts traffic using an older version of TLS.', 'Description': 'The remote service accepts connections encrypted using TLS 1.0. TLS 1.0 has a\nnumber of cryptographic design flaws. Modern implementations of TLS 1.0\nmitigate these problems, but newer versions of TLS like 1.2 and 1.3 are\ndesigned against these flaws and should be used whenever possible.\n\nAs of March 31, 2020, Endpoints that arent enabled for TLS 1.2\nand higher will no longer function properly with major web browsers and major vendors.\n\nPCI DSS v3.2 requires that TLS 1.0 be disabled entirely by June 30,\n2018, except for POS POI terminals (and the SSL/TLS termination\npoints to which they connect) that can be verified as not being\nsusceptible to any known exploits.', 'Solution': 'Enable support for TLS 1.2 and 1.3, and disable support for TLS 1.0.', 'See Also': 'https://tools.ietf.org/html/draft-ietf-tls-oldversions-deprecate-00', 'Plugin Output': 'TLSv1 is enabled and the server supports at least one cipher.', 'STIG Severity': nan, 'CVSS v4.0 Base Score': nan, 'CVSS v4.0 Base+Threat Score': nan, 'CVSS v3.0 Base Score': '6.5', 'CVSS v2.0 Temporal Score': nan, 'CVSS v3.0 Temporal Score': nan, 'VPR Score': nan, 'EPSS Score': nan, 'Risk Factor': 'Medium', 'BID': nan, 'XREF': 'CWE:327', 'MSKB': nan, 'Plugin Publication Date': '2017/11/22', 'Plugin Modification Date': '2023/04/19', 'Metasploit': nan, 'Core Impact': nan, 'CANVAS': nan}",
39,121010,,,,65.61.137.117,tcp,443,TLS Version 1.1 Protocol Detection,The remote service encrypts traffic using an older version of TLS.,"The remote service accepts connections encrypted using TLS 1.1.
TLS 1.1 lacks support for current and recommended cipher suites.
Ciphers that support encryption before MAC computation, and
authenticated encryption modes such as GCM cannot be used with
TLS 1.1

As of March 31, 2020, Endpoints that are not enabled for TLS 1.2 
and higher will no longer function properly with major web browsers and major vendors.","Enable support for TLS 1.2 and/or 1.3, and disable support for TLS 1.1.",,,,,2461.0,,"{'Plugin ID': '121010', 'CVE': nan, 'CVSS v2.0 Base Score': nan, 'Risk': nan, 'Host': '65.61.137.117', 'Protocol': 'tcp', 'Port': '443', 'Name': 'TLS Version 1.1 Protocol Detection', 'Synopsis': 'The remote service encrypts traffic using an older version of TLS.', 'Description': 'The remote service accepts connections encrypted using TLS 1.1.\nTLS 1.1 lacks support for current and recommended cipher suites.\nCiphers that support encryption before MAC computation, and\nauthenticated encryption modes such as GCM cannot be used with\nTLS 1.1\n\nAs of March 31, 2020, Endpoints that are not enabled for TLS 1.2 \nand higher will no longer function properly with major web browsers and major vendors.', 'Solution': 'Enable support for TLS 1.2 and/or 1.3, and disable support for TLS 1.1.', 'See Also': 'https://tools.ietf.org/html/draft-ietf-tls-oldversions-deprecate-00\nhttp://www.nessus.org/u?c8ae820d', 'Plugin Output': 'TLSv1.1 is enabled and the server supports at least one cipher.', 'STIG Severity': nan, 'CVSS v4.0 Base Score': nan, 'CVSS v4.0 Base+Threat Score': nan, 'CVSS v3.0 Base Score': nan, 'CVSS v2.0 Temporal Score': nan, 'CVSS v3.0 Temporal Score': nan, 'VPR Score': nan, 'EPSS Score': nan, 'Risk Factor': nan, 'BID': nan, 'XREF': 'CWE:327', 'MSKB': nan, 'Plugin Publication Date': '2019/01/08', 'Plugin Modification Date': '2023/04/19', 'Metasploit': nan, 'Core Impact': nan, 'CANVAS': nan}",
40,136318,,,,65.61.137.117,tcp,443,TLS Version 1.2 Protocol Detection,The remote service encrypts traffic using a version of TLS.,The remote service accepts connections encrypted using TLS 1.2.,,,,,,1979.0,,"{'Plugin ID': '136318', 'CVE': nan, 'CVSS v2.0 Base Score': nan, 'Risk': nan, 'Host': '65.61.137.117', 'Protocol': 'tcp', 'Port': '443', 'Name': 'TLS Version 1.2 Protocol Detection', 'Synopsis': 'The remote service encrypts traffic using a version of TLS.', 'Description': 'The remote service accepts connections encrypted using TLS 1.2.', 'Solution': nan, 'See Also': 'https://tools.ietf.org/html/rfc5246', 'Plugin Output': 'TLSv1.2 is enabled and the server supports at least one cipher.', 'STIG Severity': nan, 'CVSS v4.0 Base Score': nan, 'CVSS v4.0 Base+Threat Score': nan, 'CVSS v3.0 Base Score': nan, 'CVSS v2.0 Temporal Score': nan, 'CVSS v3.0 Temporal Score': nan, 'VPR Score': nan, 'EPSS Score': nan, 'Risk Factor': nan, 'BID': nan, 'XREF': nan, 'MSKB': nan, 'Plugin Publication Date': '2020/05/04', 'Plugin Modification Date': '2020/05/04', 'Metasploit': nan, 'Core Impact': nan, 'CANVAS': nan}",
